{
  "schemaVersion": "laidies-prose-quality-review.v1",
  "stage": "PRODUCER_SELF_REVIEW",
  "candidateId": "homepage-corrections-20260905",
  "surface": "HOMEPAGE",
  "contentClass": "PROMOTIONAL",
  "maker": "/root",
  "reviewMode": "EXACT_PROSE_IN_FULL",
  "reviewer": {
    "id": "/root",
    "principalId": "/root",
    "role": "producer",
    "modelFamily": "GPT-6"
  },
  "reviewedAt": "2026-09-06T02:06:53.716676+00:00",
  "verdict": "PASS",
  "limitations": [
    "Maker self-review only; no independent or design admission.",
    "Existing mission, historical prose and episode narration unchanged and not re-admitted by this scoped copy review.",
    "No paid AI call, research-cost pilot, account sync test or public release.",
    "Current landing text and implemented components establish availability scope, not the quality of every generated answer."
  ],
  "artifact": {
    "reviewText": {
      "path": "operations/product-stewards/town-entry-homepage/candidates/homepage-corrections-20260905/copy-changes.md",
      "sha256": "82ea4324d9ebd29614aaa24bb38183152868242647c2846ad2c36629a020a90e"
    },
    "manifest": {
      "path": "operations/product-stewards/town-entry-homepage/candidates/homepage-corrections-20260905/content-manifest.json",
      "sha256": "1014ea4089a2554cd7aeac502eaf84bcc1ce7708b38263895cb8b658c1b74ac7"
    },
    "rendered": {
      "path": "index.html",
      "sha256": "5629cada90e5ccd3b58c71c897bff0dacf4c48c60c88f74c35932b4c11f21303"
    }
  },
  "calibration": {
    "registrySha256": "e02cfa8221ae19b2121f7628cd3d04f66988bdec9938b23993ab29e3a0da98de",
    "reviewerPrincipalId": "/root",
    "reviewedAt": "2026-09-06T02:06:53.716676+00:00",
    "negatives": [
      {
        "exemplarId": "CQX-BAD-001",
        "verdict": "REJECT",
        "identifiedFailureFamilies": [
          "glossaryAccumulation",
          "templateRepetition",
          "decorativeAnalogy",
          "referenceConfetti",
          "missingMechanism",
          "genericAction",
          "jargonBeforeMeaning",
          "disconnectedSystem",
          "joylessInstruction"
        ],
        "evidence": [
          {
            "excerpt": "First, stop calling the whole thing “the AI.”",
            "locator": "opening and repeated term / analogy / In real life scaffold"
          }
        ]
      },
      {
        "exemplarId": "CQX-BAD-002",
        "verdict": "REJECT",
        "identifiedFailureFamilies": [
          "purposeTooNarrow",
          "mechanismBeforeMotivation",
          "workedExampleOvertakesBookPurpose",
          "technicalExplainerVoice"
        ],
        "evidence": [
          {
            "excerpt": "We will begin with one decision and follow it all the way through.",
            "locator": "Introduction and Chapter 1: job-offer case displaces broad orientation"
          }
        ]
      },
      {
        "exemplarId": "CQX-BAD-003",
        "verdict": "REJECT",
        "identifiedFailureFamilies": [
          "policyMemoVoice",
          "glossaryInterruptsStory",
          "checklistTurnsNewsIntoHomework",
          "missingHumanTension",
          "scaffoldingVisible",
          "technicalExplainerVoice"
        ],
        "evidence": [
          {
            "excerpt": "The concepts that make the story legible",
            "locator": "glossary interlude and five-question homework ending"
          }
        ]
      }
    ],
    "positive": {
      "exemplarId": "CQX-GOOD-INVITATION-ALI-001",
      "verdict": "PASS",
      "strengthsRetained": [
        "The yearbook joke makes the particular experience memorable and supplies a reason to try it; current experimental status remains explicit."
      ],
      "evidence": [
        {
          "excerpt": "Have a great summer!",
          "locator": "Ali Dream Phone alternative ending"
        }
      ]
    }
  },
  "reverseBrief": {
    "humanQuestion": "Where can I start, or find what I came for?",
    "promisedPayoff": "Choose a useful available route with an accurate understanding of the result.",
    "centralMentalModel": "A learning town with direct entrances for distinct visitor needs.",
    "dailyLifeConnection": "Work and career advice, questions, news, stories and a playful break.",
    "surfaceJob": "Welcome and route visitors, with current capability boundaries.",
    "desiredReaderFeeling": "Recognised, interested and able to choose without doing homework."
  },
  "outcomes": {
    "plainClarity": {
      "verdict": "PASS",
      "observation": "The named first action opens a real readable episode; the secondary action says what it helps the visitor find.",
      "artifactEvidence": [
        {
          "excerpt": "Start with Episode 1 →",
          "locator": "hero first action"
        }
      ]
    },
    "readerValue": {
      "verdict": "PASS",
      "observation": "Six recognizable needs route directly to books, Jeeves, FAiRY, news, the episode and games; the directory no longer interrupts arrival.",
      "artifactEvidence": [
        {
          "excerpt": "I could use some advice Bring FAiRY Godmother a work or career situation.",
          "locator": "intent advice card"
        }
      ]
    },
    "laidiesVoice": {
      "verdict": "PASS",
      "observation": "The specific yearbook disappointment is Ali's endorsed humour, attached to the actual Just Call experience. BWS uses the joke intrinsic to its name.",
      "artifactEvidence": [
        {
          "excerpt": "someone who would have written more than “Have a great summer!” in your yearbook.",
          "locator": "Dream Phone invitation"
        }
      ]
    },
    "engagingEnjoyable": {
      "verdict": "PASS",
      "observation": "The weekly invitation offers a short visit or a longer evening; it does not require a worksheet or a sequence of chores.",
      "artifactEvidence": [
        {
          "excerpt": "Make an evening of it, or choose the stop you have time for.",
          "locator": "weekly introduction"
        }
      ]
    },
    "factualIntegrity": {
      "verdict": "PASS",
      "observation": "Capability wording is bounded to existing routes. FAiRY is qualified to work/career, Miss Jeeves to LAiDIES coverage, and the Dream Phone game remains experimental. No paid research or automatic freshness guarantee is added.",
      "artifactEvidence": [
        {
          "excerpt": "The full game is still experimental.",
          "locator": "Dream Phone invitation"
        }
      ]
    },
    "freshnessReviewability": {
      "verdict": "PASS",
      "observation": "Date-stamped current receiving-page text and exact HTML locators bind feature promises. Role, availability, route or account-scope changes require a copy recheck.",
      "artifactEvidence": [
        {
          "excerpt": "She works best with questions covered by LAiDIES.",
          "locator": "Miss Jeeves beta qualification"
        }
      ]
    },
    "surfaceFit": {
      "verdict": "PASS",
      "observation": "These are homepage invitations and route descriptions. Existing teaching and mission statements are retained; no new explanatory tutorial is inserted.",
      "artifactEvidence": [
        {
          "excerpt": "Looking for a particular place? Browse every game, tool and building.",
          "locator": "collapsed directory"
        }
      ]
    },
    "truthfulPromise": {
      "verdict": "PASS",
      "observation": "The field trip is the verified existing LUMINAiRY entrance. Card/device and provider sign-in boundaries remain visible.",
      "artifactEvidence": [
        {
          "excerpt": "Episode 04 takes you to the LUMINAiRY to meet the MAiVENS and TRAiLBLAZERS",
          "locator": "method practice card"
        }
      ]
    },
    "clearAction": {
      "verdict": "PASS",
      "observation": "The broken Express invitation is replaced with the precise episode action; original direct form submission wording is preserved on receipt.",
      "artifactEvidence": [
        {
          "excerpt": "Just here for the episode? Open the latest story and choose read or listen.",
          "locator": "weekly last action"
        }
      ]
    }
  },
  "failureFamilies": {
    "benchmarkNameDrop": {
      "present": false,
      "observation": "Not present in this bounded promotional correction: no new technical lesson, glossary, policy argument or transfer assignment is drafted; concrete route and visitor purpose come first.",
      "artifactLocator": "copy-changes.md: complete changed wording; relevant route and invitation blocks"
    },
    "checklistTurnsNewsIntoHomework": {
      "present": false,
      "observation": "Not present in this bounded promotional correction: no new technical lesson, glossary, policy argument or transfer assignment is drafted; concrete route and visitor purpose come first.",
      "artifactLocator": "copy-changes.md: complete changed wording; relevant route and invitation blocks"
    },
    "communicationPastiche": {
      "present": false,
      "observation": "Not present in this bounded promotional correction: no new technical lesson, glossary, policy argument or transfer assignment is drafted; concrete route and visitor purpose come first.",
      "artifactLocator": "copy-changes.md: complete changed wording; relevant route and invitation blocks"
    },
    "corporateSludge": {
      "present": false,
      "observation": "Not present in this bounded promotional correction: no new technical lesson, glossary, policy argument or transfer assignment is drafted; concrete route and visitor purpose come first.",
      "artifactLocator": "copy-changes.md: complete changed wording; relevant route and invitation blocks"
    },
    "curiosityWithoutPayoff": {
      "present": false,
      "observation": "Not present in this bounded promotional correction: no new technical lesson, glossary, policy argument or transfer assignment is drafted; concrete route and visitor purpose come first.",